{
  "version": 1,
  "review_status": "parent_adjudicated_provisional",
  "description": "Synthetic gold labels. An independent blind agent reviewer agreed with all 40 status labels before TypeSafe output existed; the parent adjudicated the positive evidence IDs and exact source spans after review.",
  "independent_review": {
    "status_labels_agreed": 40,
    "reviewed_before_typesafe_output": true,
    "parent_adjudicated_evidence_ids": true
  },
  "cases": [
    {
      "stimulus_id": "fixed-01",
      "expected_window_status": "fixed_dates",
      "expected_evidence_id": "fixed-01-p1",
      "expected_source_url": "https://synthetic.example/fixed-01/apply",
      "expected_exact_quote": "Applications for the 2028 intake close on 11 January 2028.",
      "no_update": true,
      "adjudication_note": "Synthetic source label; verify against the frozen page text."
    },
    {
      "stimulus_id": "fixed-02",
      "expected_window_status": "fixed_dates",
      "expected_evidence_id": "fixed-02-p1",
      "expected_source_url": "https://synthetic.example/fixed-02/apply",
      "expected_exact_quote": "Applications for the 2027 intake close on 12 February 2027.",
      "no_update": true,
      "adjudication_note": "Synthetic source label; verify against the frozen page text."
    },
    {
      "stimulus_id": "fixed-03",
      "expected_window_status": "fixed_dates",
      "expected_evidence_id": "fixed-03-p1",
      "expected_source_url": "https://synthetic.example/fixed-03/apply",
      "expected_exact_quote": "Applications for the 2028 intake close on 13 March 2028.",
      "no_update": true,
      "adjudication_note": "Synthetic source label; verify against the frozen page text."
    },
    {
      "stimulus_id": "fixed-04",
      "expected_window_status": "fixed_dates",
      "expected_evidence_id": "fixed-04-p1",
      "expected_source_url": "https://synthetic.example/fixed-04/apply",
      "expected_exact_quote": "Applications for the 2027 intake close on 14 April 2027.",
      "no_update": true,
      "adjudication_note": "Synthetic source label; verify against the frozen page text."
    },
    {
      "stimulus_id": "fixed-05",
      "expected_window_status": "fixed_dates",
      "expected_evidence_id": "fixed-05-p1",
      "expected_source_url": "https://synthetic.example/fixed-05/apply",
      "expected_exact_quote": "Applications for the 2028 intake close on 15 May 2028.",
      "no_update": true,
      "adjudication_note": "Synthetic source label; verify against the frozen page text."
    },
    {
      "stimulus_id": "fixed-06",
      "expected_window_status": "fixed_dates",
      "expected_evidence_id": "fixed-06-p1",
      "expected_source_url": "https://synthetic.example/fixed-06/apply",
      "expected_exact_quote": "Applications for the 2027 intake close on 16 June 2027.",
      "no_update": true,
      "adjudication_note": "Synthetic source label; verify against the frozen page text."
    },
    {
      "stimulus_id": "fixed-07",
      "expected_window_status": "fixed_dates",
      "expected_evidence_id": "fixed-07-p1",
      "expected_source_url": "https://synthetic.example/fixed-07/apply",
      "expected_exact_quote": "Applications for the 2028 intake close on 17 July 2028.",
      "no_update": true,
      "adjudication_note": "Synthetic source label; verify against the frozen page text."
    },
    {
      "stimulus_id": "fixed-08",
      "expected_window_status": "fixed_dates",
      "expected_evidence_id": "fixed-08-p1",
      "expected_source_url": "https://synthetic.example/fixed-08/apply",
      "expected_exact_quote": "Applications for the 2027 intake close on 18 August 2027.",
      "no_update": true,
      "adjudication_note": "Synthetic source label; verify against the frozen page text."
    },
    {
      "stimulus_id": "rolling-01",
      "expected_window_status": "rolling",
      "expected_evidence_id": "rolling-01-p1",
      "expected_source_url": "https://synthetic.example/rolling-01/apply",
      "expected_exact_quote": "The programme accepts applications at any time; applicants may request a start date each month.",
      "no_update": true,
      "adjudication_note": "Synthetic source label; verify against the frozen page text."
    },
    {
      "stimulus_id": "rolling-02",
      "expected_window_status": "rolling",
      "expected_evidence_id": "rolling-02-p1",
      "expected_source_url": "https://synthetic.example/rolling-02/apply",
      "expected_exact_quote": "Applications are accepted throughout the year, with monthly placement starts.",
      "no_update": true,
      "adjudication_note": "Synthetic source label; verify against the frozen page text."
    },
    {
      "stimulus_id": "rolling-03",
      "expected_window_status": "rolling",
      "expected_evidence_id": "rolling-03-p1",
      "expected_source_url": "https://synthetic.example/rolling-03/apply",
      "expected_exact_quote": "The programme accepts applications at any time; applicants may request a start date each month.",
      "no_update": true,
      "adjudication_note": "Synthetic source label; verify against the frozen page text."
    },
    {
      "stimulus_id": "rolling-04",
      "expected_window_status": "rolling",
      "expected_evidence_id": "rolling-04-p1",
      "expected_source_url": "https://synthetic.example/rolling-04/apply",
      "expected_exact_quote": "Applications are accepted throughout the year, with monthly placement starts.",
      "no_update": true,
      "adjudication_note": "Synthetic source label; verify against the frozen page text."
    },
    {
      "stimulus_id": "rolling-05",
      "expected_window_status": "rolling",
      "expected_evidence_id": "rolling-05-p1",
      "expected_source_url": "https://synthetic.example/rolling-05/apply",
      "expected_exact_quote": "The programme accepts applications at any time; applicants may request a start date each month.",
      "no_update": true,
      "adjudication_note": "Synthetic source label; verify against the frozen page text."
    },
    {
      "stimulus_id": "rolling-06",
      "expected_window_status": "rolling",
      "expected_evidence_id": "rolling-06-p1",
      "expected_source_url": "https://synthetic.example/rolling-06/apply",
      "expected_exact_quote": "Applications are accepted throughout the year, with monthly placement starts.",
      "no_update": true,
      "adjudication_note": "Synthetic source label; verify against the frozen page text."
    },
    {
      "stimulus_id": "rolling-07",
      "expected_window_status": "rolling",
      "expected_evidence_id": "rolling-07-p1",
      "expected_source_url": "https://synthetic.example/rolling-07/apply",
      "expected_exact_quote": "The programme accepts applications at any time; applicants may request a start date each month.",
      "no_update": true,
      "adjudication_note": "Synthetic source label; verify against the frozen page text."
    },
    {
      "stimulus_id": "rolling-08",
      "expected_window_status": "rolling",
      "expected_evidence_id": "rolling-08-p1",
      "expected_source_url": "https://synthetic.example/rolling-08/apply",
      "expected_exact_quote": "Applications are accepted throughout the year, with monthly placement starts.",
      "no_update": true,
      "adjudication_note": "Synthetic source label; verify against the frozen page text."
    },
    {
      "stimulus_id": "not-stated-01",
      "expected_window_status": "not_stated",
      "expected_evidence_id": "none",
      "expected_source_url": null,
      "expected_exact_quote": null,
      "no_update": true,
      "adjudication_note": "Both program and apply pages were read; candidates are deliberate non-window decoys."
    },
    {
      "stimulus_id": "not-stated-02",
      "expected_window_status": "not_stated",
      "expected_evidence_id": "none",
      "expected_source_url": null,
      "expected_exact_quote": null,
      "no_update": true,
      "adjudication_note": "Both program and apply pages were read; candidates are deliberate non-window decoys."
    },
    {
      "stimulus_id": "not-stated-03",
      "expected_window_status": "not_stated",
      "expected_evidence_id": "none",
      "expected_source_url": null,
      "expected_exact_quote": null,
      "no_update": true,
      "adjudication_note": "Both program and apply pages were read; candidates are deliberate non-window decoys."
    },
    {
      "stimulus_id": "not-stated-04",
      "expected_window_status": "not_stated",
      "expected_evidence_id": "none",
      "expected_source_url": null,
      "expected_exact_quote": null,
      "no_update": true,
      "adjudication_note": "Both program and apply pages were read; candidates are deliberate non-window decoys."
    },
    {
      "stimulus_id": "not-stated-05",
      "expected_window_status": "not_stated",
      "expected_evidence_id": "none",
      "expected_source_url": null,
      "expected_exact_quote": null,
      "no_update": true,
      "adjudication_note": "Both program and apply pages were read; candidates are deliberate non-window decoys."
    },
    {
      "stimulus_id": "not-stated-06",
      "expected_window_status": "not_stated",
      "expected_evidence_id": "none",
      "expected_source_url": null,
      "expected_exact_quote": null,
      "no_update": true,
      "adjudication_note": "Both program and apply pages were read; candidates are deliberate non-window decoys."
    },
    {
      "stimulus_id": "not-stated-07",
      "expected_window_status": "not_stated",
      "expected_evidence_id": "none",
      "expected_source_url": null,
      "expected_exact_quote": null,
      "no_update": true,
      "adjudication_note": "Both program and apply pages were read; candidates are deliberate non-window decoys."
    },
    {
      "stimulus_id": "not-stated-08",
      "expected_window_status": "not_stated",
      "expected_evidence_id": "none",
      "expected_source_url": null,
      "expected_exact_quote": null,